<?xml version="1.0" encoding="UTF-8"?>

<projects xmlns="http://www.savetheforest.com" xmlns:xsi="http://www.w3.org/2001/XMLSchema-instance" xsi:schemaLocation="http://www.savetheforest.com
                             projects.xsd">
    <project>
        <id>0</id>
        <title>Title Test</title>
        <description>Description</description>
        <image>project1.png</image>
        <goal>50000</goal>
        <raised>30000</raised>
    </project>
    <project>
        <id>0</id>
        <title>Title Test</title>
        <description>Description</description>
        <image>project1.png</image>
        <goal>50000</goal>
        <raised>30000</raised>
    </project>
    <project>
        <id>0</id>
        <title>Title Test</title>
        <description>Description</description>
        <image>project1.png</image>
        <goal>50000</goal>
        <raised>30000</raised>
    </project>
    <project>
        <id>0</id>
        <title>Title Test</title>
        <description>Description</description>
        <image>project1.png</image>
        <goal>50000</goal>
        <raised>30000</raised>
    </project>
    <project>
        <id>0</id>
        <title>Title Test</title>
        <description>Description</description>
        <image>project1.png</image>
        <goal>50000</goal>
        <raised>30000</raised>
    </project>
    <project>
        <id>0</id>
        <title>Title Test</title>
        <description>Description</description>
        <image>project1.png</image>
        <goal>50000</goal>
        <raised>30000</raised>
    </project>
</projects>